Role,Difficulty,Question,Answer
Full Stack Developer,Medium,How does React communicate with a backend server?,React communicates with backend services through REST APIs or GraphQL using Fetch API or Axios. The server returns JSON data that updates the user interface.
Full Stack Developer,Medium,Explain CRUD operations.,"CRUD stands for Create, Read, Update, and Delete. These are the four basic operations performed on database records through backend APIs."
Full Stack Developer,Medium,What is CORS?,Cross-Origin Resource Sharing (CORS) is a browser security mechanism that allows controlled access to resources from different origins using HTTP headers.
Full Stack Developer,Medium,Explain JWT Authentication.,"JWT (JSON Web Token) is a secure token-based authentication mechanism. After successful login, a signed token is generated and included with future requests for user verification."
Full Stack Developer,Medium,What is database normalization?,"Normalization organizes database tables to reduce redundancy and improve data integrity. Common normal forms include 1NF, 2NF, 3NF, and BCNF."
Full Stack Developer,Hard,How would you design Adobe Document Cloud?,"The system should include user authentication, secure document storage, PDF processing services, version control, collaboration features, REST APIs, caching, CDN integration, load balancing, encryption, and cloud-based scalable storage."
Full Stack Developer,Hard,Explain Docker and its advantages.,"Docker packages applications and their dependencies into lightweight containers, ensuring consistent execution across development, testing, and production while simplifying deployment."
Full Stack Developer,Hard,What is CI/CD?,"CI/CD stands for Continuous Integration and Continuous Deployment. It automates code building, testing, and deployment, enabling faster, more reliable, and consistent software releases."
Full Stack Developer,Hard,How would you secure a full stack application?,"Secure the application using HTTPS, JWT or OAuth authentication, password hashing, SQL injection prevention, XSS and CSRF protection, input validation, encryption of sensitive data, secure APIs, and role-based authorization."
Full Stack Developer,Hard,Explain Microservices Architecture.,"Microservices Architecture divides an application into independent services that communicate through REST APIs or message queues. Each service can be developed, deployed, and scaled independently, improving scalability, fault isolation, and maintainability."
